<?xml version="1.0" encoding="UTF-8"?>
<!--Sample XML file generated by XMLSpy v2009 sp1 (http://www.altova.com)-->
<Document xsi:schemaLocation="urn:cnaps:std:saps:2010:tech:xsd:saps.734.001.01 saps.734.001.01.xsd" xmlns="urn:cnaps:std:saps:2010:tech:xsd:saps.734.001.01" xmlns:xsi="http://www.w3.org/2001/XMLSchema-instance">
	<ACSTCBSAnlAcctg>
		<GrpHdr>
			<MsgId>2010090912555591</MsgId>
			<CreDtTm>2010-09-09T09:30:47</CreDtTm>
			<InstgPty>
				<InstgDrctPty>0000</InstgDrctPty>
				<InstgPty>0000</InstgPty>
			</InstgPty>
			<InstdPty>
				<InstdDrctPty>308581000106</InstdDrctPty>
				<InstdPty>308581000106</InstdPty>
			</InstdPty>
			<SysCd>SAPS</SysCd>
			<Rmk>a</Rmk>
		</GrpHdr>
		<ACSTCBSAnlAcctgInf>
			<Acct>1234308581000106</Acct>
			<InitlAmt>1000.00</InitlAmt>
			<AnlDbtrAmt>1000.00</AnlDbtrAmt>
			<AnlCdtrAmt>1000.00</AnlCdtrAmt>
			<FnlAmt>1000.00</FnlAmt>
		</ACSTCBSAnlAcctgInf>
	</ACSTCBSAnlAcctg>
</Document>
